"1807437","2.4.1.","2.4.1. Управление информационной безопасностью и обеспечение информационной безопасности","21","ОББП_2.4.1.","0","1676386","2018-03-22","2100-01-01","Защита субъектов информационных отношений Банка от возможного нанесения им ущерба посредством случайного или преднамеренного воздействия на информацию, ее носители, процессы обработки и передачи, а также минимизация уровня рисков","Объекты защиты информации. Угрозы информационной безопасности, уязвимости программного обеспечения. Информация согласно ЛПА Банка для: идентификации рисков информационной безопасности; идентификации и оценки активов; проведения мониторинга результативности СМИБ. Заявки на доступ к информации. Информация согласно требованиям стандарта ISO 27001 для: документирования; проведения аудита СМИБ. Результаты действий, проводимых по итогам предыдущих анализов со стороны руководства. Результаты аудита СМИБ. Информация о кандидатах, \r\nпринимаемых на работу, о работниках, о контрагентах. Информация о компьютерных угрозах, полученная от внешних центров реагирования на компьютерные угрозы (CERT)","Обнаруженные и устраненные (предотвращенные) события и инциденты информационной безопасности, (вредоносное программное обеспечение, утечка информации, уязвимости программного обеспечения и др.). Защищенная информация. Назначение (изъятие) прав доступа. Результаты мониторинга и измерений и меры по совершенствованию СМИБ при наличии отклонений Отчетность согласно ЛНПА Банка. Пройденный работником тест по информационной безопасности. План обработки рисков нарушения ИБ.\r\nПеречень активов, определение их ценности и ответственности по их защите. Документированная информация СМИБ. Решения и действия, связанные с реализацией возможностей для постоянного улучшения и любыми потребностями в изменениях СМИБ. Корректирующие действия по результатам аудита СМИБ. Договорные соглашения с работниками и контрагентами. Настройки средств телекоммуникаций.\r\nОбучающие курсы и тесты для работников и контрагентов. Реализованная политика использования криптографических средств защиты информации. Резервное копирование информации, программного обеспечения и образов систем. Информация о компьютерных угрозах, выявленных в банке, переданная внешним центрам реагирования на компьютерные угрозы (CERT)","",""
"1807438","2.4.2.","2.4.2. Обеспечение пропускного и внутриобъектового режима","21","ОББП_2.4.2.","0","1676386","2018-03-22","2100-01-01","Обеспечение охраны материальных ценностей, физической безопасности работников Банка","ЛНПА Банка, охраняемые объекты Банка","Совокупность организационных, технических мероприятий и правил, направленных на сохранность материальных ценностей и документов, установление порядка доступа в зоны ограничения, обеспечение режима секретности, пропускного режима","",""
"1676341","3.1.4.1.","3.1.4.1. Кредит в текущую деятельность (возобновляемая кредитная линия, единовременный, невозобновляемая кредитная линия) в рамках госпрограмм и мероприятий","3","ОСБПКК_3.1.4.1.","0","1676410","2017-04-20","2100-01-01","Предоставление кредита в текущую   деятельность корпоративным клиентам в рамках госпрограмм и мероприятий","Ходатайство корпоративного клиента на получение кредита; необходимый пакет документов для рассмотрения вопроса о предоставлении кредита согласно ЛНПА Банка","Заключения заинтересованных служб Банка, подготовленные для принятия решения об осуществлении (изменении условий осуществления) активной операций. Решение уполномоченного коллегиального органа (уполномоченного должностного лица) Банка. Кредитный договор; договор(ы) обеспечения; перечисленные в соответствии с условиями кредитного договора денежные средства; исполненные обязательства по кредитному договору; закрытая кредитная сделка","Кредиты в текущую  деятельностьв белорусских рублях и иностранной валюте.",""
"1676517","3.1.4.3.","3.1.4.3. Кредит на финансирование строительства жилья на селе","3","ОСБПКК_3.1.4.3.","0","1676410","2017-04-20","2100-01-01","Льготное кредитование жилищного строительства в сельской местности","Поступление пакета документов от юридического лица, рассмотрение представленных документов, оценка кредитоспособности и правоспособности потенциального заемщика, подготовка заключения специалистами банка, рассмотрение вопроса о выдаче кредита на уполномоченном коллегиальном органе.","Заключения заинтересованных служб Банка, подготовленные для принятия решения об осуществлении (изменении условий осуществления) активной операций. Решение уполномоченного коллегиального органа (уполномоченного должностного лица) Банка. Кредитный договор; договор(ы) обеспечения; перечисленные в соответствии с условиями кредитного договора денежные средства; исполненные обязательства по кредитному договору; закрытая кредитная сделка","Льготные кредиты на приобретение жилья в сельской местности в белорусских рублях.Льготные кредиты на строительство/ реконструкцию/ ремонт жилья на селе в белорусских рублях.",""
"1676489","3.1.4.4.","3.1.4.4. Кредит за счет средств иностранных кредитно-финансовых организаций","2","ОСБПКК_3.1.4.4.","0","1676410","2017-04-20","2100-01-01","Предоставление кредита за счет средств иностранных кредитно-финансовых организаций корпоративным клиентам","Ходатайство корпоративного клиента на получение кредита; необходимый пакет документов для рассмотрения вопроса о предоставлении кредита согласно ЛНПА банка","Заключения заинтересованных служб Банка, подготовленные для принятия решения об осуществлении (изменении условий осуществления) активной операций. Решение уполномоченного коллегиального органа (уполномоченного должностного лица) Банка. Привлеченная иностранная кредитная линия для кредитования клиента.\r\nКредитный договор; договор(ы) обеспечения; перечисленные в соответствии с условиями кредитного договора денежные средства; исполненные обязательства по кредитному договору; закрытая кредитная сделка","",""
"1676305","3.2.2.7.","3.2.2.7. Овердрафтное кредитование с использованием дебетовых банковских платежных карточек","4","ОСБПФЛ_3.2.2.7.","0","1676320","2017-04-20","2100-01-01","Увеличение доли банка на рынке потребительского кредитования за счет овердрафтного кредитования с использованием дебетовых банковских платежных карточек, выполнение показателя охвата овердрафтным кредитованием клиентов, находящихся на зарплатном обслуживании","Документ, удостоверяющий личность. Заявление-анкета заявителя. Желание клиента оформить овердрафтный кредит","Заключения заинтересованных служб Банка, подготовленные для принятия решения об осуществлении (изменении условий осуществления) активной операций. Решение уполномоченного коллегиального органа (уполномоченного должностного лица) Банка. Договор, содержащий условия овердрафтного кредитования; использованные в соответствии с указаниями кредитополучателя денежные средства посредством личной дебетовой банковской платежной карточки либо её реквизитов; погашенный клиентом основной долг; уплаченные проценты за пользование овердрафтным кредитом. Предоставленная/оказанная услуга (закрытый договор, сформированное архивное дело).","Овердрафтный кредит.",""